{
  "$schema": "https://json-schema.org/draft/2020-12/schema",
  "$id": "https://commodity.local/contracts/sealed-windows/v1",
  "title": "Commodity Sealed Confirmation Registry",
  "type": "object",
  "additionalProperties": false,
  "required": [
    "schema_version",
    "zoom_level",
    "programme_id",
    "windows"
  ],
  "properties": {
    "schema_version": {
      "const": 1
    },
    "windows": {
      "type": "array",
      "items": {
        "type": "object",
        "additionalProperties": false,
        "required": [
          "sealed_window_id",
          "dataset_id",
          "start",
          "end",
          "content_sha256",
          "eligibility",
          "permitted_openings",
          "openings"
        ],
        "properties": {
          "sealed_window_id": {
            "type": "string",
            "minLength": 1
          },
          "dataset_id": {
            "type": "string",
            "minLength": 1
          },
          "start": {
            "type": "string",
            "minLength": 1
          },
          "end": {
            "type": "string",
            "minLength": 1
          },
          "content_sha256": {
            "type": "string",
            "pattern": "^[0-9a-fA-F]{64}$"
          },
          "preparation_assurance": {
            "type": "object",
            "additionalProperties": false,
            "required": [
              "scope",
              "status",
              "protected_outcomes_accessed",
              "prepared_rows",
              "reserved_rows",
              "purged_boundary_rows"
            ],
            "properties": {
              "scope": {
                "const": "full_prepared_frame"
              },
              "status": {
                "const": "passed"
              },
              "protected_outcomes_accessed": {
                "const": false
              },
              "prepared_rows": {
                "type": "integer",
                "minimum": 1
              },
              "reserved_rows": {
                "type": "integer",
                "minimum": 1
              },
              "purged_boundary_rows": {
                "type": "integer",
                "minimum": 0
              }
            }
          },
          "eligibility": {
            "enum": [
              "eligible",
              "ineligible",
              "exhausted"
            ]
          },
          "permitted_openings": {
            "type": "integer",
            "minimum": 1
          },
          "openings": {
            "type": "array",
            "items": {
              "type": "object",
              "required": [
                "opening_number",
                "experiment_id",
                "artifacts_exposed"
              ],
              "properties": {
                "opening_number": {
                  "type": "integer",
                  "minimum": 1
                },
                "experiment_id": {
                  "type": "string"
                },
                "artifacts_exposed": {
                  "type": "array"
                }
              }
            }
          }
        }
      }
    },
    "zoom_level": {
      "const": "L1"
    },
    "programme_id": {
      "type": "string",
      "pattern": "^[0-9]{3}-[a-z0-9-]+$"
    }
  }
}
